hypothesis_id,session_id,title,summary,generation_strategy,generation_round,elo_rating,rating_deviation,status,parent_ids,created_at,updated_at
hypothesis_a541a436b719,sleep_hypothesis_session,Thalamic Morphology Modulates Thalamocortical Coupling in Insomnia,"This hypothesis proposes that thalamic morphology influences thalamocortical coupling in insomnia, linking structural and functional brain changes.",literature_exploration,1,1446.0,126.0,active,[],2026-07-01T11:46:20.284353+00:00,2026-07-01T12:04:43.637050+00:00
hypothesis_6d2cb6ed13cc,sleep_hypothesis_session,Bidirectional Thalamocortical Coupling and Structural Morphology in Insomnia,"This hypothesis proposes a bidirectional interaction between thalamic structural morphology and thalamocortical coupling in insomnia, integrating multimodal neuroimaging data.",scientific_debate,2,1594.0,132.0,active,[],2026-07-01T11:48:06.242450+00:00,2026-07-01T12:04:09.443930+00:00
hypothesis_e84c1a6dacb7,sleep_hypothesis_session,Thalamocortical Coupling Modulates Insomnia Severity via Structural Morphology,"This hypothesis proposes that thalamocortical coupling influences insomnia severity through structural morphology changes, integrating functional and structural neuroimaging data.",assumption_chaining,3,1211.0,124.0,active,[],2026-07-01T11:48:48.717301+00:00,2026-07-01T12:05:26.363787+00:00
hypothesis_5213e370154e,sleep_hypothesis_session,Thalamic Morphology Modulates Thalamocortical Coupling in Insomnia,"This hypothesis proposes that thalamic morphology influences thalamocortical coupling in insomnia, linking structural and functional brain changes.",research_expansion,4,1070.0,129.0,active,[],2026-07-01T11:49:28.729154+00:00,2026-07-01T12:05:26.363800+00:00
hypothesis_69c0f9ed163f,sleep_hypothesis_session,Bidirectional Thalamocortical Coupling and Structural Morphology with Cross-Pollinated Mechanisms in Insomnia,"This hypothesis integrates bidirectional thalamocortical coupling and structural morphology with cross-pollinated mechanisms from other top hypotheses, enhancing coherence and evidence grounding.",evolution:cross_pollination,2,1330.0,143.0,active,"['hypothesis_6d2cb6ed13cc', 'hypothesis_a541a436b719', 'hypothesis_e84c1a6dacb7']",2026-07-01T11:57:44.418351+00:00,2026-07-01T12:05:15.223402+00:00
